<?xml version="1.0" encoding="UTF-8"?>
<!DOCTYPE informe SYSTEM "Ejercicio21Externo.dtd">
<informe fecha="30/12/2009" descrip="informe de ventas para las regiones Norte, Centro y Sur">
	<region zona="Norte">
		<trimestres>
		<trimestre numero="1">
			<librosvendidos>24000</librosvendidos>
		</trimestre>
		<trimestre numero="2">
			<librosvendidos>38600</librosvendidos>
		</trimestre>
		<trimestre numero="3">
			<librosvendidos>NO_INFO</librosvendidos>
		</trimestre>
		<trimestre numero="4">
			<librosvendidos>NO_INFO</librosvendidos>
		</trimestre>
		</trimestres>
	</region>
	<region zona="Centro">
		<trimestres>
		<trimestre numero="1">
			<librosvendidos>NO_INFO</librosvendidos>
		</trimestre>
		<trimestre numero="2">
			<librosvendidos>16080</librosvendidos>
		</trimestre>
		<trimestre numero="3">
			<librosvendidos>25000</librosvendidos>
		</trimestre>
		<trimestre numero="4">
			<librosvendidos>NO_INFO</librosvendidos>
		</trimestre>
		</trimestres>
	</region>
	<region zona="Sur">
		<trimestres>
		<trimestre numero="1">
			<librosvendidos>27000</librosvendidos>
		</trimestre>
		<trimestre numero="2">
			<librosvendidos>31400</librosvendidos>
		</trimestre>
		<trimestre numero="3">
			<librosvendidos>40100</librosvendidos>
		</trimestre>
		<trimestre numero="4">
			<librosvendidos>30000</librosvendidos>
		</trimestre>
		</trimestres>
	</region>
</informe>